{
  "title": "Getting Started Guide",
  "description": "A comprehensive guide to using the PDF sharing website. Learn how to navigate, search, and interact with documents.",
  "tags": ["guide", "tutorial", "getting-started", "help"],
  "author": "Website Administrator",
  "featured": true,
  "uploadDate": "2025-01-15T10:30:00Z",
  "pageCount": 12,
  "category": "Documentation"
}