{
  "title": "Technical Reference Manual",
  "description": "Technical documentation covering system architecture, API references, and implementation details for developers.",
  "tags": ["technical", "reference", "api", "development", "architecture"],
  "author": "Development Team",
  "featured": false,
  "uploadDate": "2025-01-10T14:20:00Z",
  "pageCount": 45,
  "category": "Technical"
}