{
  "title": "User Manual v2.1",
  "description": "Complete user manual covering all features and functionality. Includes step-by-step instructions and troubleshooting tips.",
  "tags": ["manual", "user-guide", "instructions", "help", "features"],
  "author": "Documentation Team",
  "featured": true,
  "uploadDate": "2025-01-12T09:15:00Z",
  "pageCount": 28,
  "category": "Documentation"
}